{
  "schemaVersion": "1.0.0",
  "kind": "fidelity-validation-report",
  "pageId": "b-dpr2",
  "stateId": "default",
  "generatedAt": "2026-10-28T14:32:45.675Z",
  "status": "PASS",
  "reason": null,
  "scorecard": {
    "schemaVersion": "1.0.0",
    "generatedAt": "2026-10-28T14:32:45.674Z",
    "dimensions": {
      "geometry": {
        "checks": {
          "total": 16,
          "pass": 16,
          "fail": 0,
          "unverified": 0
        },
        "metrics": {
          "position": {
            "total": 8,
            "fail": 0,
            "criticalFail": 0,
            "maxAbsPx": 0,
            "meanAbsPx": 0
          },
          "size": {
            "total": 8,
            "fail": 0,
            "criticalFail": 0,
            "maxAbsPx": 0,
            "meanAbsPx": 0
          }
        },
        "verdict": "PASS"
      },
      "typography": {
        "checks": {
          "total": 44,
          "fail": 0,
          "pass": 44,
          "unverified": 0
        },
        "metrics": {
          "style": {
            "total": 32,
            "fail": 0,
            "unverified": 0,
            "criticalFail": 0
          },
          "text": {
            "total": 6,
            "fail": 0
          },
          "wrap": {
            "total": 6,
            "fail": 0
          }
        },
        "verdict": "PASS"
      },
      "appearance": {
        "checks": {
          "total": 64,
          "fail": 0,
          "pass": 64,
          "unverified": 0
        },
        "metrics": {
          "style": {
            "total": 56,
            "fail": 0,
            "unverified": 0,
            "criticalFail": 0
          },
          "missingOnTarget": 0,
          "missingOnPrototype": 0,
          "notApplicable": 0
        },
        "verdict": "PASS"
      },
      "state": {
        "checks": {
          "total": 4,
          "pass": 4,
          "fail": 0,
          "unverified": 0,
          "blocked": 0
        },
        "metrics": {},
        "verdict": "PASS"
      },
      "interaction": {
        "checks": {
          "total": 1,
          "pass": 1,
          "fail": 0,
          "unverified": 0,
          "blocked": 0
        },
        "metrics": {},
        "verdict": "PASS"
      }
    },
    "criticalFailures": [],
    "nonCriticalFailures": [],
    "budget": {
      "criticalFailures": 0,
      "nonCriticalFailures": 0
    },
    "coverage": {
      "pairsDeclared": 8,
      "criticalPairs": 3,
      "pairsMeasured": 8,
      "pairsUnverified": 0,
      "notApplicable": 0,
      "missingOnTarget": 0,
      "missingOnPrototype": 0,
      "pixelsCompared": 0
    },
    "verdict": "PASS"
  },
  "interaction": {
    "checks": [
      {
        "id": "toggle-note",
        "title": "点按钮后说明展开",
        "status": "PASS",
        "expected": {
          "textIncludes": {
            "selector": "#b-note",
            "text": "已展开"
          }
        },
        "observed": "ok text(#b-note) includes \"已展开\" → 说明已展开",
        "assertions": [
          {
            "assertion": "text(#b-note) includes \"已展开\"",
            "pass": true,
            "observed": "说明已展开"
          }
        ],
        "startedAt": "2026-10-28T14:32:44.725Z",
        "screenshotPath": null,
        "finishedAt": "2026-10-28T14:32:45.495Z",
        "durationMs": 770,
        "verification": "real-action-and-observation"
      }
    ],
    "fail": 0,
    "unverified": 0,
    "status": "PASS"
  },
  "evidence": [
    "visual-diff-report.json",
    "captures/b-dpr2/default/prototype/capture-manifest.json",
    "captures/b-dpr2/default/target/capture-manifest.json"
  ],
  "limitations": [
    "Target screenshot is 2.0000×2.0000 of CSS px; region crops are normalised to the smaller side before diffing.",
    "Container pixel comparisons masked over declared child regions (each child is judged at its own level): b-card ← b-label/b-clock/b-desc"
  ]
}
